{
    "Profile": {
        "PTS": null,
        "Type": "Scanner Dome",
        "ES": "5+",
        "KS": "5+",
        "Special": []
    },
    "Weapons": [],
    "Load": [],
    "Rules": "When you assign any weapons to an enemy Ship/Group within 6\" of this Dropsite, improve the Lock of those weapons by 1.\nWhen you attack an enemy Descent Ship in Atmosphere within 6\" of this Dropsite, instead of the usual penalties for attacking a City or a Descent Ship in Atmosphere (see paragraph 4 of 3.1.2 Atmosphere) that attack always hits on a 5+ and can never cause a critical (instead of a 6+).\ne.g. a weapon with Lock 3+ attacking a target in orbit within 6\" of this Dropsite would improve its Lock to 2+. If that weapon was attacking a Descent Ship in Atmosphere within 6\" of this Dropsite, it would always hit on a 5+ and will not cause criticals. A weapon with Bombardment attacking the same Descent Ship would hit on its Lock value improved by 1."
}